{
  "标的基本画像": {
    "标的名称": "某半导体设备公司",
    "标的类型": "Company",
    "所属产业或行业": "半导体设备",
    "核心业务或研究范围": "面向晶圆厂客户的先进制程设备销售、交付和服务",
    "收入来源": "设备销售、备件和服务收入",
    "利润来源": "设备交付后的收入确认和订单毛利率",
    "产业链位置": "半导体制造设备环节",
    "主要相关主体": {
      "客户": ["晶圆厂客户", "先进制程客户"],
      "供应商": ["关键零部件供应商"],
      "竞争对手": ["海外设备厂商", "国内同类设备公司"],
      "其他相关主体": ["交易所公告", "行业研究机构"]
    }
  },
  "当前研究触发点": {
    "触发事件": "2025Q1 新签订单同比增长 45%。",
    "市场关注点": "订单增长能否转化为未来收入确认和利润改善。",
    "核心分歧": "订单增长代表需求改善，还是低毛利或延迟交付订单带来的短期表观增长。",
    "当前研究必要性": "订单高增长改变未来收入能见度，但利润传导仍需合同负债、交付和毛利率验证。",
    "来源证据": ["某半导体设备公司财报点评第 3 页"]
  },
  "核心投资问题": [
    {
      "问题": "订单增长能否在 1-3 个季度内转化为收入确认。",
      "对应状态变量": ["新签订单", "合同负债", "发出商品", "验收节点", "收入确认节奏"],
      "当前回答": "单篇材料支持订单到收入能见度改善，仍需后续财报验证。",
      "待验证点": "合同负债、发出商品、交付验收节点和收入确认进度。"
    },
    {
      "问题": "订单增长是否能带来利润改善。",
      "对应状态变量": ["订单毛利率", "毛利率", "收入确认节奏"],
      "当前回答": "利润改善仍不确定，毛利率低于历史均值会削弱传导。",
      "待验证点": "后续毛利率和订单结构。"
    }
  ],
  "关键状态变量": [
    {
      "状态变量": "新签订单",
      "当前状态": "2025Q1 同比增长 45%",
      "变化方向": "改善",
      "重要性": "高",
      "依据": "材料披露新签订单同比增长。"
    },
    {
      "状态变量": "毛利率",
      "当前状态": "未提供后续读数",
      "变化方向": "未知",
      "重要性": "高",
      "依据": "材料明确毛利率低于历史均值会削弱利润传导。"
    }
  ],
  "证据与验证信号": [
    {
      "证据或信号": "合同负债变化",
      "对应状态变量": "订单能见度",
      "支持或反证": "跟踪",
      "数据来源": "后续财报",
      "跟踪频率": "季度"
    },
    {
      "证据或信号": "发出商品和验收节点",
      "对应状态变量": "收入确认节奏",
      "支持或反证": "跟踪",
      "数据来源": "后续财报、公告或公司交流纪要",
      "跟踪频率": "季度"
    },
    {
      "证据或信号": "毛利率是否低于历史均值",
      "对应状态变量": "毛利率",
      "支持或反证": "反证",
      "数据来源": "后续财报",
      "跟踪频率": "季度"
    }
  ],
  "传导逻辑": {
    "事件或变化": "新签订单同比高增长。",
    "影响的状态变量": ["订单能见度", "收入确认节奏", "毛利率"],
    "对业务的影响": "订单增长提升未来交付和收入确认的业务基础。",
    "对财务的影响": "若交付、发出商品转收入和验收按期完成，未来 1-3 个季度收入确认概率提升；若毛利率下行，利润传导减弱。",
    "对估值或市场预期的影响": "市场可能上修收入能见度预期，但利润预期需要毛利率验证。",
    "边界条件": "交付延期、验收延迟或毛利率低于历史均值。"
  },
  "估值与资产影响": {
    "收入影响": "订单增长对未来收入确认形成正向候选影响。",
    "利润影响": "利润影响取决于订单毛利率和费用吸收情况。",
    "估值影响": "收入能见度改善可能提升市场对增长确定性的定价，但缺少利润验证时估值提升受限。",
    "市场可能反映路径": "若后续合同负债、收入确认和毛利率共同验证，市场可能先反映收入确定性，再反映利润弹性。",
    "市场预期差": "分歧集中在订单质量和交付兑现，而非订单增长事实本身。",
    "合规边界": "本部分不生成买卖建议、目标价、收益率预测或仓位建议。"
  },
  "结论": {
    "当前判断": "订单增长构成收入能见度改善的单来源候选线索，利润改善仍待验证。",
    "判断级别": "单来源候选",
    "成立条件": ["合同负债维持或增加", "发出商品和验收节点按期转化", "收入确认按期推进", "毛利率不低于历史均值"],
    "反证条件": ["交付延期", "验收延迟", "发出商品无法转收入", "毛利率低于历史均值"],
    "后续跟踪重点": ["下一期合同负债", "发出商品变化", "收入确认节奏", "毛利率变化", "客户验证进度"]
  },
  "风险提示": {
    "基本面风险": ["订单交付延期", "订单毛利率低于历史均值"],
    "行业风险": ["晶圆厂扩产节奏下修", "设备招标规模低于预期"],
    "估值风险": ["市场提前定价订单改善", "收入验证前估值波动加大"],
    "数据不确定性": ["当前样例只包含单篇材料", "缺少公司公告和历史样本交叉验证"]
  }
}
